{"args":["--manifest","fixtures/design-system-compiler/targets.manifest.json","--out","artifacts/design-system-compiler"],"artifacts":[{"hash":"16ae80992f534fb423c77bb64538243956c726e5935a0363ca099376bb6dd28e","hashAlgorithm":"sha256","path":"artifacts/design-system-compiler/astryx-core-button/boundary-receipt.json","schemaId":"catalog-boundary-receipt.v0"},{"hash":"61d866d3c4bd03b9477fd6f8252c505cf5330005bd2be6f008046f2cd7f795e2","hashAlgorithm":"sha256","path":"artifacts/design-system-compiler/astryx-core-button/catalog.json","schemaId":"runtime-catalog.v0"},{"hash":"a38498081e8e3b31323a2e80c26b089e83bfc9d6c23c7b69e4fb73ea91bc883b","hashAlgorithm":"sha256","path":"artifacts/design-system-compiler/astryx-core-button/consumer-report.json","schemaId":"catalog-consumer-report.v0"},{"hash":"3cb1566ae337d413795d1b5972d87df965f6fe0c5b3bc671c5e277a61047dfec","hashAlgorithm":"sha256","path":"artifacts/design-system-compiler/astryx-core-button/extract.json","schemaId":"extract.v0"},{"hash":"b87076d31741dfe577a726e90ca94dea453909df168c4a51ae9da6f09b6bb951","hashAlgorithm":"sha256","path":"artifacts/design-system-compiler/astryx-core-button/governed-catalog.json","schemaId":"runtime-catalog.v0"},{"hash":"a028f35be174652a0f80699149753b0a3d0e80de0744ccb609b6e9ddc0a08f01","hashAlgorithm":"sha256","path":"artifacts/design-system-compiler/astryx-core-button/render-plan.json","schemaId":"catalog-render-plan.v0"},{"hash":"a09d0df10fa51a2bbd1a3fccea0a5e5baea00e8dd8df6e7153968972bc23f75b","hashAlgorithm":"sha256","path":"artifacts/design-system-compiler/astryx-core-button/runtime-projection.json","schemaId":"catalog-runtime-projection.v0"},{"hash":"7489e3633a71c70f094fb15f6407d88205ea46197e0583ae66808bcebecdeeed","hashAlgorithm":"sha256","path":"artifacts/design-system-compiler/design-system-compiler-report.json","schemaId":"design-system-compiler-report.v0"},{"hash":"03c6a30e9911f77ac8e8d5c70f1ef40ada80be814eb94b28db311413f323b224","hashAlgorithm":"sha256","path":"artifacts/design-system-compiler/spectrum-switch/boundary-receipt.json","schemaId":"catalog-boundary-receipt.v0"},{"hash":"95ddfc47f6a92dfe83fcc0e2f8f218b12d0e2ca7c03d90c5042fee29aa8a3032","hashAlgorithm":"sha256","path":"artifacts/design-system-compiler/spectrum-switch/catalog.json","schemaId":"runtime-catalog.v0"},{"hash":"f3f73d6c0b1d90643808edac08348c4296ea3ecdb11b0cddf414ff297c360328","hashAlgorithm":"sha256","path":"artifacts/design-system-compiler/spectrum-switch/consumer-report.json","schemaId":"catalog-consumer-report.v0"},{"hash":"9bb6252279d48c755a9a446c0ac5947251a3ed6519f03067aea3876f298b99c9","hashAlgorithm":"sha256","path":"artifacts/design-system-compiler/spectrum-switch/extract.json","schemaId":"extract.v0"},{"hash":"ebad4e8e4655b0bd46d23ac8da08f8540306a33efe35b15b4b65518fe785909c","hashAlgorithm":"sha256","path":"artifacts/design-system-compiler/spectrum-switch/governed-catalog.json","schemaId":"runtime-catalog.v0"},{"hash":"bb97da44b737bcff29e65b4042205b07ed3bcea575fa1b6a3da06068998903a5","hashAlgorithm":"sha256","path":"artifacts/design-system-compiler/spectrum-switch/render-plan.json","schemaId":"catalog-render-plan.v0"},{"hash":"8d89f46c4fa3da41865e90b0a3a1ea3c25153614c1ef1b367f1d5ee921bf2c5f","hashAlgorithm":"sha256","path":"artifacts/design-system-compiler/spectrum-switch/runtime-projection.json","schemaId":"catalog-runtime-projection.v0"},{"hash":"c12af6fdc35fb863053b9931aee8769c6eea62751b94589cdea130eb47d95dc2","hashAlgorithm":"sha256","path":"artifacts/design-system-compiler/evidence.json","schemaId":"design-system-compiler-evidence.v0"}],"command":"interfacectl surfaces design-system-compiler proof","contractId":"surfaces-design-system-compiler-proof","diagnostics":[{"artifactPath":"fixtures/design-system-compiler/astryx-core/blocked-unknown-member.catalog-consumer-fixture.json","code":"CONSUMER_UNKNOWN_MEMBER","message":"The consumer fixture references component authority absent from the governed catalog.","path":"/props/tone","promotionStatus":"blocked","severity":"error","sourceRef":"astryx-docs://npm/@astryxdesign/core@0.1.2/package/src/Button/Button.doc.mjs#anchor=componentName","stage":"consumer","suggestedAction":"Reject the request without rendering, executing actions, or producing side effects."},{"artifactPath":"fixtures/design-system-compiler/astryx-core/review-promotion.catalog-consumer-fixture.json","code":"CONSUMER_REVIEW_REQUIRED","message":"The requested catalog promotion remains owner-review required.","path":"/intent","promotionStatus":"review_required","severity":"review","sourceRef":"astryx-docs://npm/@astryxdesign/core@0.1.2/package/src/Button/Button.doc.mjs#anchor=actionIntent","stage":"consumer","suggestedAction":"Preserve owner review and do not emit a promoted render plan."},{"artifactPath":"fixtures/design-system-compiler/spectrum-switch/blocked-unknown-prop.catalog-consumer-fixture.json","code":"CONSUMER_UNKNOWN_MEMBER","message":"The consumer fixture references component authority absent from the governed catalog.","path":"/props/ariaLabel","promotionStatus":"blocked","severity":"error","sourceRef":"spectrum-design-data://npm/@adobe/spectrum-design-data@0.7.0/package/components/switch.json#/name","stage":"consumer","suggestedAction":"Reject the request without rendering, executing actions, or producing side effects."},{"artifactPath":"fixtures/design-system-compiler/spectrum-switch/review-promotion.catalog-consumer-fixture.json","code":"CONSUMER_REVIEW_REQUIRED","message":"The requested catalog promotion remains owner-review required.","path":"/intent","promotionStatus":"review_required","severity":"review","sourceRef":"spectrum-design-data://npm/@adobe/spectrum-design-data@0.7.0/package/components/switch.json#/accessibility","stage":"consumer","suggestedAction":"Preserve owner review and do not emit a promoted render plan."}],"implementationRefs":[{"hash":"59aabff0a0a7697906976b1044d914af07f4f2d46a0499480de51c77fc1a9990","hashAlgorithm":"sha256","hashMode":"raw-bytes","path":".github/workflows/surfaces-proof.yml"},{"hash":"92e546e3b009a0158823c69b475de037088c2fcb99f0b288e2ad818a492c825d","hashAlgorithm":"sha256","hashMode":"raw-bytes","path":"PLAN.md"},{"hash":"dfc730bc5dc89f47de6c08b28e56c7163fc436fd9d467dcf268c24bac62ce7ad","hashAlgorithm":"sha256","hashMode":"raw-bytes","path":"PROGRESS.md"},{"hash":"29092f788d773f82491634f358d96d3d280338ac482c4dc23733ce8377a94b82","hashAlgorithm":"sha256","hashMode":"raw-bytes","path":"README.md"},{"hash":"72b7a6c505e3996e3a60c4961d4b16888aeeacc07edadf6afc2e287ec8284def","hashAlgorithm":"sha256","hashMode":"raw-bytes","path":"VISION.md"},{"hash":"75de7d32eb1c399d6c0210351d629b80aae59078965416be80f2fb80c59a21a2","hashAlgorithm":"sha256","hashMode":"raw-bytes","path":"bin/interfacectl.js"},{"hash":"c2119af847941ee804365aa6642e097accdaec25fb769832f60b4bd90f2f4254","hashAlgorithm":"sha256","hashMode":"raw-bytes","path":"package-lock.json"},{"hash":"d3307142ed7769308b034599e638a4d99f83007f1d73f291a022bd71f31449a9","hashAlgorithm":"sha256","hashMode":"raw-bytes","path":"package.json"},{"hash":"bc47120c088f7443ebb208b2cfc22b2e0e7c872e9b413c6f0c194f74360e0a3e","hashAlgorithm":"sha256","hashMode":"raw-bytes","path":"plans/README.md"},{"hash":"edc4eb3bd0bc37ca3f18f339d4831dc555063925fa4c2a0ca8f1fbe3cb598ac0","hashAlgorithm":"sha256","hashMode":"raw-bytes","path":"plans/capability-index.md"},{"hash":"1d53c345b7663365e398b92b6335ffd36fb777d78d51d11a8839b751063c1fbe","hashAlgorithm":"sha256","hashMode":"raw-bytes","path":"plans/design-system-compiler.md"},{"hash":"919e578258b16ff541914255248c94975e896979a81c9cfd9264fe9165834e4a","hashAlgorithm":"sha256","hashMode":"raw-bytes","path":"plans/design-system-readiness.md"},{"hash":"0291c2ac42345b80087292e4b3e782e75fd249e054c7bf847fe5ff463c141c80","hashAlgorithm":"sha256","hashMode":"raw-bytes","path":"plans/product-designer-workflow.md"},{"hash":"dacb813e17fb5fa62ae765f6b4cfaa22f5fdcc66e2e103fe34189b5a5ade6c99","hashAlgorithm":"sha256","hashMode":"raw-bytes","path":"plans/source-family-component-identity-mapping.md"},{"hash":"bd2bb20e9b53d91a887ad3905e953488181cf3187ff5bd26f772cc6551474f80","hashAlgorithm":"sha256","hashMode":"raw-bytes","path":"plans/surfaces-dev.md"},{"hash":"2064f8ecbcae729cf394e65a086ae6725626d13a9e3a684589a41ad648218c2d","hashAlgorithm":"sha256","hashMode":"raw-bytes","path":"schemas/catalog-boundary-receipt.v0.schema.json"},{"hash":"1a9c6d103a2271b15a3e009c3e0add388b0939b840b37c97af9d6b5a16db16d6","hashAlgorithm":"sha256","hashMode":"raw-bytes","path":"schemas/catalog-consumer-fixture.v0.schema.json"},{"hash":"b59bf1eb6a1d07df55fc365b482b81c87beb7cd252fb5f9ece3c333fe9ad3305","hashAlgorithm":"sha256","hashMode":"raw-bytes","path":"schemas/catalog-consumer-report.v0.schema.json"},{"hash":"5d1d95e4aa71a303a24ada43b78930414cf54f7e033beef7bb389415038d8867","hashAlgorithm":"sha256","hashMode":"raw-bytes","path":"schemas/catalog-render-plan.v0.schema.json"},{"hash":"fdb962806e3656336d53a25bbae2400fe08aaf5577a58ae3246e89ba5b209411","hashAlgorithm":"sha256","hashMode":"raw-bytes","path":"schemas/catalog-runtime-projection.v0.schema.json"},{"hash":"bc9eb3f6fa19f5d087c2ad460ec6162889caa1f90b7e3fcb7715ce721d22ddf1","hashAlgorithm":"sha256","hashMode":"raw-bytes","path":"schemas/design-system-adapter.v0.schema.json"},{"hash":"da7a5608610d5979a2fec2a476e2d9c502ee85ae621319e223db540a5be7839c","hashAlgorithm":"sha256","hashMode":"raw-bytes","path":"schemas/design-system-compiler-diagnostics.v0.schema.json"},{"hash":"3303afe5057de82d77a4d7264145a2a9d1d2fec1772bc78cfcbc75f8c26fb706","hashAlgorithm":"sha256","hashMode":"raw-bytes","path":"schemas/design-system-compiler-evidence.v0.schema.json"},{"hash":"0bec93b21b615a01c11e4f14e3a344397ae99066bafd20eb7c569e9fa3e0eccb","hashAlgorithm":"sha256","hashMode":"raw-bytes","path":"schemas/design-system-compiler-manifest.v0.schema.json"},{"hash":"eced7d67b978ac171e01d1909f72580e2658cad5f2839b45b31cdf4a3ead5ba3","hashAlgorithm":"sha256","hashMode":"raw-bytes","path":"schemas/design-system-compiler-